{
  "arv": "1.0",
  "origin": "https://example.com",
  "publisher": {
    "name": "Example Garage"
  },
  "assets": [
    {
      "arv": "1.0",
      "id": "vid_8f2c",
      "title": "Tuning a carburettor",
      "duration_ms": 1284000,
      "language": "en",
      "content_hash": "sha256:9b1e...",
      "creator": {
        "id": "cr_12",
        "name": "Example Garage",
        "url": "https://example.com"
      },
      "page_url": "https://example.com/videos/carb",
      "c2pa": {
        "credentials_url": "https://example.com/c2pa/vid_8f2c"
      },
      "extensions": {
        "com.mux": {
          "playback_id": "abc"
        }
      },
      "modified_at": "2026-10-17T03:05:12.004Z"
    }
  ],
  "moments": [],
  "removed": [
    "vid_91aa"
  ],
  "until": "c1.MTc5MjIwNjYyODg2OQ",
  "next_since": "c1.MTc5MjIwNjUwODg2OQ"
}
